{
  "run_id": "001-xhs-ai-agent-save-one-hour",
  "scenario": "xiaohongshu-creator",
  "publish_mode": "human_review_then_draft",
  "content_artifact": "runs/001-xhs-ai-agent-save-one-hour/generated-note.md",
  "gate_order": [
    "quality_score",
    "human_review",
    "risk_approval",
    "account_state",
    "mode_approval",
    "platform_handoff",
    "proof_verification",
    "recipe_promotion"
  ],
  "gates": {
    "quality_score": {
      "status": "passed",
      "checked_at": "2026-05-25T00:00:00+08:00",
      "evidence_ref": "runs/001-xhs-ai-agent-save-one-hour/quality-score.json",
      "notes": "Content score was 95 and numeric threshold passed."
    },
    "human_review": {
      "status": "failed",
      "checked_at": "2026-05-25T11:38:28+08:00",
      "evidence_ref": "runs/001-xhs-ai-agent-save-one-hour/human-review.md",
      "notes": "Gate verdict is invalid_for_publish; no final pre-publish approval exists."
    },
    "risk_approval": {
      "status": "failed",
      "checked_at": "2026-05-25T11:38:28+08:00",
      "evidence_ref": "runs/001-xhs-ai-agent-save-one-hour/human-review.md",
      "notes": "Risk approval is missing before platform handoff."
    },
    "account_state": {
      "status": "failed",
      "checked_at": "2026-05-25T11:38:28+08:00",
      "evidence_ref": "runs/001-xhs-ai-agent-save-one-hour/human-review.md",
      "notes": "Independent account-state pass evidence is missing before platform handoff."
    },
    "mode_approval": {
      "status": "failed",
      "checked_at": "2026-05-25T11:38:28+08:00",
      "evidence_ref": "runs/001-xhs-ai-agent-save-one-hour/human-review.md",
      "notes": "Original mode was human_review_then_draft; attempted publish mode escalation approval is missing."
    },
    "platform_handoff": {
      "status": "failed",
      "checked_at": "2026-05-25T09:00:07+08:00",
      "evidence_ref": "runs/001-xhs-ai-agent-save-one-hour/publish-proof.md",
      "notes": "Publish fact exists, but the handoff happened without a complete preceding gate chain."
    },
    "proof_verification": {
      "status": "failed",
      "checked_at": "2026-05-25T11:38:28+08:00",
      "evidence_ref": "runs/001-xhs-ai-agent-save-one-hour/publish-proof.md",
      "notes": "Publish fact proof is valid, but compliant publish proof is invalid."
    },
    "recipe_promotion": {
      "status": "failed",
      "checked_at": "2026-05-25T11:38:28+08:00",
      "evidence_ref": "failed-recipes/xhs-ai-agent-save-one-hour.recipe.md",
      "notes": "Recipe status is failed and must not be promoted under verified-recipes."
    }
  },
  "final_verdict": "failed"
}
